{
  "$schema": "https://json-schema.org/draft/2020-12/schema",
  "$id": "https://orestra.dev/schemas/v1alpha1/service.schema.json",
  "title": "Orestra Service v1alpha1",
  "type": "object",
  "additionalProperties": false,
  "required": [
    "apiVersion",
    "kind",
    "metadata",
    "spec"
  ],
  "properties": {
    "apiVersion": {
      "const": "orestra.io/v1alpha1"
    },
    "kind": {
      "const": "Service"
    },
    "metadata": {
      "type": "object",
      "required": [
        "name",
        "namespace",
        "uid",
        "generation",
        "resourceVersion"
      ],
      "additionalProperties": false,
      "properties": {
        "name": {
          "type": "string",
          "pattern": "^[a-z0-9]([-a-z0-9]*[a-z0-9])?$",
          "maxLength": 63
        },
        "namespace": {
          "type": "string",
          "pattern": "^[a-z0-9]([-a-z0-9]*[a-z0-9])?$",
          "maxLength": 63
        },
        "uid": {
          "type": "string",
          "minLength": 1,
          "maxLength": 128
        },
        "generation": {
          "type": "integer",
          "minimum": 1
        },
        "resourceVersion": {
          "type": "string",
          "minLength": 1,
          "maxLength": 64
        },
        "labels": {
          "type": "object",
          "additionalProperties": {
            "type": "string"
          }
        },
        "annotations": {
          "type": "object",
          "additionalProperties": {
            "type": "string"
          }
        },
        "deletionTimestamp": {
          "type": [
            "string",
            "null"
          ],
          "format": "date-time"
        }
      }
    },
    "spec": {
      "type": "object",
      "additionalProperties": false,
      "required": [
        "selector",
        "ports"
      ],
      "properties": {
        "selector": {
          "type": "object",
          "minProperties": 1,
          "additionalProperties": {
            "type": "string"
          }
        },
        "ports": {
          "type": "array",
          "minItems": 1,
          "items": {
            "type": "object",
            "additionalProperties": false,
            "required": [
              "port",
              "targetPort",
              "protocol"
            ],
            "properties": {
              "name": {
                "type": "string"
              },
              "port": {
                "type": "integer",
                "minimum": 1,
                "maximum": 65535
              },
              "targetPort": {
                "type": "integer",
                "minimum": 1,
                "maximum": 65535
              },
              "protocol": {
                "enum": [
                  "TCP",
                  "UDP"
                ]
              }
            }
          }
        },
        "type": {
          "enum": [
            "ClusterIP",
            "Headless"
          ]
        }
      }
    },
    "status": {
      "type": "object",
      "additionalProperties": false,
      "properties": {
        "observedGeneration": {
          "type": "integer",
          "minimum": 0
        },
        "readyEndpoints": {
          "type": "integer",
          "minimum": 0
        }
      }
    }
  }
}
